id	text	location	time_zone	date
418125476633526272	"My New Years resolution is to think of a better road rage insult while in traffic. ""TURD!"" is just getting overplayed. #NewYearsResolution"	Philadelphia, Pa	Eastern Time (US & Canada)	Tue Dec 31 21:04:16 +0000 2013
418125476939722752	My New Years resolution is to eliminate the word 'literally' from my vocabulary		Eastern Time (US & Canada)	Tue Dec 31 21:04:16 +0000 2013
418125478328008704	New Years resolution: Steal your man😌 Just kidding. That would be mean. I'm stealing your girl also to even it out. #jk #iamnotthatcool		Atlantic Time (Canada)	Tue Dec 31 21:04:17 +0000 2013
418125479757901825	"""@Cadriel_: New Years Resolution: fuck more bitches, get more money"""	Brownsville, Texas	Mountain Time (US & Canada)	Tue Dec 31 21:04:17 +0000 2013
418125479909265408	@Chelsea_Clarkee lmao! my New Years resolution: continue riding that wavelength		Amsterdam	Tue Dec 31 21:04:17 +0000 2013
418125482383523840	"“@ForeverrBased: New Years Resolution?
Fuck That Shit
Nothing Wrong With Me”"		Eastern Time (US & Canada)	Tue Dec 31 21:04:18 +0000 2013
418125482442235904	My New Years resolution is that I actually become attractive.			Tue Dec 31 21:04:18 +0000 2013
418125485391245312	New Years resolution this year yeah I don't think I have one 🙈🙈			Tue Dec 31 21:04:18 +0000 2013
418125485487685632	@ollyofficial what's your New Years resolution? :D	olly's house		Tue Dec 31 21:04:18 +0000 2013
418125489887141888	my new years resolution is to become a puppy i don'T CARE	puerto rico.	Atlantic Time (Canada)	Tue Dec 31 21:04:19 +0000 2013
418125489543598080	My New Years resolution: To be better than 2013 and more successful	Polokwane		Tue Dec 31 21:04:19 +0000 2013
418125489900101632	“@Andrea37436789: New years resolution: Stop skipping”		Central Time (US & Canada)	Tue Dec 31 21:04:19 +0000 2013
418125490801881088	New Years resolution is to figure out what 'boggin' even means	starbucks		Tue Dec 31 21:04:20 +0000 2013
418125493204819968	My New Years resolution is to attempt to not wear sweatpants/lulus everyday and mix in some jeans once in a while #jk #notgonnahappen		Pacific Time (US & Canada)	Tue Dec 31 21:04:20 +0000 2013
418125496795152384	My New Years resolution: floss more			Tue Dec 31 21:04:21 +0000 2013
418125504286175232	Not gonna make a New Years resolution, I'm not starting off the year lying to my face	Oxford	London	Tue Dec 31 21:04:23 +0000 2013
418125504818851840	my new years resolution is probably to talk to more of my followers/people in general bc i need friends	shitland	London	Tue Dec 31 21:04:23 +0000 2013
418125508857970688	My New Years resolution... Do more stupid stuff with the best people I know,  that we should regret later but won't.			Tue Dec 31 21:04:24 +0000 2013
418125510565462017	My New Years Resolution? Don't have one because I have been on this grind for awhile. Winning is a 24/7 attitude and work ethic #none needed			Tue Dec 31 21:04:24 +0000 2013
418125510883815424	I'll give you 5 dollars if any of you keep your New Years resolution until February	Tucson, Az		Tue Dec 31 21:04:24 +0000 2013
418125511463014400	My New Years resolution is to do absolutely whatever it is that makes me happy. And to smile even more than I did in 2013. 😁 #thatsall	probably by the food	Eastern Time (US & Canada)	Tue Dec 31 21:04:24 +0000 2013
418125513375227904	Win each day forget having a new years resolution have a resolution every day		Central Time (US & Canada)	Tue Dec 31 21:04:25 +0000 2013
418125513933066240	I might as well be a New Years resolution.... Because no body will do me		Central Time (US & Canada)	Tue Dec 31 21:04:25 +0000 2013
418125517766676480	my new years resolution is to stop being so in love with A$AP Rocky... lol who am i kidding?	IG: my_lostworld	Eastern Time (US & Canada)	Tue Dec 31 21:04:26 +0000 2013
418125518039293952	I don't even know what my new years resolution is gunna be..		Central Time (US & Canada)	Tue Dec 31 21:04:26 +0000 2013
418125518803070976	New Years resolution: I'm not going to eat McDonalds until next year... Starting now... 😏		Mountain Time (US & Canada)	Tue Dec 31 21:04:26 +0000 2013
418125519041724416	New Years resolution get @jakemiller to tweet me he loves me (if that even makes sense) but for real 😏😍	Cleveland, OH	Eastern Time (US & Canada)	Tue Dec 31 21:04:26 +0000 2013
418125523286372354	My only legit New Years resolution is to go to sleep earlier.	Clutch City, Red Nation	Central Time (US & Canada)	Tue Dec 31 21:04:27 +0000 2013
418125531302084608	My new years resolution is to trip balls and stay proper		Eastern Time (US & Canada)	Tue Dec 31 21:04:29 +0000 2013
418125531381776385	New Years resolution: QUIT MY FUCKING JOB		Eastern Time (US & Canada)	Tue Dec 31 21:04:29 +0000 2013
418125534506143745	Ladies, let your New Years resolution be to take care of yourself and appreciate your beauty so someone else will.	verdeville, nc	Central Time (US & Canada)	Tue Dec 31 21:04:30 +0000 2013
418125535227944960	New Years resolution is to stop being a little bitch &amp; throw my stuff at nationals.	Stay Strong	Central Time (US & Canada)	Tue Dec 31 21:04:30 +0000 2013
418125536792424449	'New years resolution' meet @ROOM94 SO GETCHO ARSES OUTSIDE KOKO BEFORE THE SHOW OKAY? COS I COULDNT GET VIP AND I WANNA CRY!		London	Tue Dec 31 21:04:31 +0000 2013
418125537748324352	My New Years resolution is to stop all of pollution.	San Antonio	Eastern Time (US & Canada)	Tue Dec 31 21:04:31 +0000 2013
418125538197110784	My New Years resolution is to better myself and my friendships, so I can be the Nice, Sweet, and Loving person I was meant to be! I'll do it	Xbox GT: JChaos15	Eastern Time (US & Canada)	Tue Dec 31 21:04:31 +0000 2013
418125539283456002	New Years Resolution: Survive my 21st birthday.	Greenville, NC	Atlantic Time (Canada)	Tue Dec 31 21:04:31 +0000 2013
418125540822745088	My new years resolution: get drunk, get high, get money fuck bitches	Honduras	Central America	Tue Dec 31 21:04:31 +0000 2013
418125541133131776	New Years resolution: don't die	outlier	Mountain Time (US & Canada)	Tue Dec 31 21:04:32 +0000 2013
418125540843720704	It's so hard to pick a New Years resolution cause I always just find an excuse to break it and not give a fuck 😂😏😄			Tue Dec 31 21:04:31 +0000 2013
418125541473288192	My New Years resolution is to marry Natalie Portman ❤️😍💍	South Carolina	Atlantic Time (Canada)	Tue Dec 31 21:04:32 +0000 2013
418125542987407361	Fuck that New Years resolution shit	Cemetery	Central Time (US & Canada)	Tue Dec 31 21:04:32 +0000 2013
418125547047485440	Let our New Years Resolution be this: we will be there for one another as fellow members of humanity, in the finest sense of the word -...	Boston, Massachusetts	Eastern Time (US & Canada)	Tue Dec 31 21:04:33 +0000 2013
418125547462344704	"""@AlwaysFreshAFA: I wonder if this lady's New Years resolution is to leave Sketchers in 1994"" @2pac_oo"			Tue Dec 31 21:04:33 +0000 2013
418125547680837632	My New Years resolution last year was to stop being so scared to have fun, and to let loose in 2013.....👍		Atlantic Time (Canada)	Tue Dec 31 21:04:33 +0000 2013
418125563224944641	A new Nigga is some Bitches New Years Resolution.	charleston, SC	Quito	Tue Dec 31 21:04:37 +0000 2013
418125567536672768	My new years resolution: to be pretty and skinny	Wonderland	Brasilia	Tue Dec 31 21:04:38 +0000 2013
418125568170033152	New Years resolution is to be meaner actually	Long Island	Quito	Tue Dec 31 21:04:38 +0000 2013
418125568849108992	@GIBAM_Movement your New Years resolution! We will retweet it!	Gee-Bam, Nation	Mountain Time (US & Canada)	Tue Dec 31 21:04:38 +0000 2013
418125570958839808	@KathCim @LaurenCimorelli My new years resolution is for you to follow me your the only girls left and it would mean the world if you did:)	Chickenville		Tue Dec 31 21:04:39 +0000 2013
418125572829483008	My 2013 New Years resolution was to stretch everyday so I could do the splits. I actually stretched every day and can now do the splits :)			Tue Dec 31 21:04:39 +0000 2013
418125573781585920	A New Years resolution I can keep - eat more chocolate! #2014	Melbourne, Australia	Melbourne	Tue Dec 31 21:04:39 +0000 2013
418125574474072065	“@Alex_Monaco_: Fuck a new years resolution Ive been on my grind”			Tue Dec 31 21:04:40 +0000 2013
418125575019315200	New Years Resolution: stop letting dickwads and assholes try to push me around. No more!!!  I got my big girl pants on!	Milwaukee	Central Time (US & Canada)	Tue Dec 31 21:04:40 +0000 2013
418125575455129600	new years resolution is to officially marry yata misaki	germany		Tue Dec 31 21:04:40 +0000 2013
418125575698403328	New Years resolution is to get a job			Tue Dec 31 21:04:40 +0000 2013
418125581931147264	New Years resolution: stop having feelings	Rhode Island		Tue Dec 31 21:04:41 +0000 2013
418125582900424704	My New Years resolution is to stop drinking &amp; smoking..	On The Throne	Pacific Time (US & Canada)	Tue Dec 31 21:04:42 +0000 2013
418125582829117440	"High five!""@1MightyMidget: I don't have a New Years resolution."""	Gainesville, Florida	Eastern Time (US & Canada)	Tue Dec 31 21:04:42 +0000 2013
418125584607510528	@SmethwickAlbion aye mate and yourself. New Years resolution is sing figs! Have good new year chap!	Stoke/Wolverhampton	Casablanca	Tue Dec 31 21:04:42 +0000 2013
418125589011501056	@Krewella My New Years Resolution is to support u as much as I can! So I made this acc! :) #Krew @KrewellaJahan @krewellayasmine @omgRainMan	Germany; Munich		Tue Dec 31 21:04:43 +0000 2013
418125590961852416	Fuck a New Years Resolution. #begreatallthetime	carson california	Pacific Time (US & Canada)	Tue Dec 31 21:04:43 +0000 2013
418125593956192256	New Years resolution? Or naaaahhh?		Central Time (US & Canada)	Tue Dec 31 21:04:44 +0000 2013
418125594573160448	Maybe your New Years resolution should be to grow up.	April 25, 2013		Tue Dec 31 21:04:44 +0000 2013
418125594988007425	My New Years resolution is that people will be nice to each other this year and people will not stab each other in the back.			Tue Dec 31 21:04:44 +0000 2013
418125596573462528	Great now all the new years resolution people are gonna crowd the gym. Go home #yousuck#giveup#yourfat		Eastern Time (US & Canada)	Tue Dec 31 21:04:45 +0000 2013
418125598704168960	my new years resolution is to be more confident and show people the real me not the person that they want to see only!		Quito	Tue Dec 31 21:04:45 +0000 2013
418125600033763330	@kelrosendale New Years resolution 😮😮😮😮😈😈🆗🆗🆗🆗🆗🆗🆗❤️💩❤️💗💃💩❤️💃💃💩❤️🌲😋😋😋😋😋💗❤️💜🆗		Pacific Time (US & Canada)	Tue Dec 31 21:04:46 +0000 2013
418125601891840001	My New Years Resolution is TO NOT HAVE ONE!! #overrated			Tue Dec 31 21:04:46 +0000 2013
418125602693328896	gym as much as possible because for about a week after today its gonna be packed w/ people tryna change their body for new years resolution		Eastern Time (US & Canada)	Tue Dec 31 21:04:46 +0000 2013
418125603263373312	Please don't make getting back into shape your New Years resolution, we both know it's not happening so don't crowd the gym please	Toronto	Quito	Tue Dec 31 21:04:46 +0000 2013
418125603783860224	my new years resolution is to look at things from everyone elses point of view and also to give back more.	5.19.13 •  8.7.13 • 9.21.13	Pacific Time (US & Canada)	Tue Dec 31 21:04:47 +0000 2013
418125603809013760	"@HappyBekki 365 days later: ""New Years Resolution: Going to try using Twitter more frequently. Apologies in advance."" THIS TIME FOR REAL"	I defy matter	Alaska	Tue Dec 31 21:04:47 +0000 2013
418125605746786304	2014 New Years resolution: learn to count to 2014	UA	Central Time (US & Canada)	Tue Dec 31 21:04:47 +0000 2013
418125607059222528	@NintendoAmerica how about this for a new years resolution! release pokemon bank!!! you fucktards!!!!!	westland, MI	Pacific Time (US & Canada)	Tue Dec 31 21:04:47 +0000 2013
418125609571586048	My New Years resolution is to be a Victoria Secret angel ok	Garden Grove	Pacific Time (US & Canada)	Tue Dec 31 21:04:48 +0000 2013
418125610091683841	"""@rodrijack55: My new years resolution is.... NOTHING! i just want to live life everyday as it is &amp; not give a fuck! #StressFreeLife"""	PARA-PARA-PARADISE	Eastern Time (US & Canada)	Tue Dec 31 21:04:48 +0000 2013
418125613917282304	My New Years Resolution : to focus on becoming a person better and be more successful than last year		Quito	Tue Dec 31 21:04:49 +0000 2013
418125615661727744	Yall got the same new years resolution  EVERY  YEAR!  we don't care	2[EastSide]3.	Pacific Time (US & Canada)	Tue Dec 31 21:04:49 +0000 2013
418125616689713152	New Years Resolution Number One: Get My Eyebrows in Check 🙈✔️😒 #thestruggle	NotOfThisWorld	Arizona	Tue Dec 31 21:04:50 +0000 2013
418125617326858240	"""@drunksixthgrade: my new years resolution is to fuck ur bitch 2014 times"""			Tue Dec 31 21:04:50 +0000 2013
418125617842774016	My New Years resolution is to watch the office more.	behind my macbook.	Pacific Time (US & Canada)	Tue Dec 31 21:04:50 +0000 2013
418125619679866880	I always forget my new years resolution by the first month	Blackpool	Alaska	Tue Dec 31 21:04:50 +0000 2013
418125620737232896	Im making a new years resolution for @LizzenHere ....check your texts more often. From me, at least. :)		Eastern Time (US & Canada)	Tue Dec 31 21:04:51 +0000 2013
418125622276141056	New Years resolution: Buy VIP tickets for the @ATTILAga New Kings Tour!		Pacific Time (US & Canada)	Tue Dec 31 21:04:51 +0000 2013
418125622867927040	New Years resolution: less acne	murlund	Atlantic Time (Canada)	Tue Dec 31 21:04:51 +0000 2013
418125623299932161	@TomSaget good New Years resolution for 2014!	Miami / Los Angeles		Tue Dec 31 21:04:51 +0000 2013
418125627385188352	Anyone have a new years's resolution for 2014????			Tue Dec 31 21:04:52 +0000 2013
418125628693819392	"If I'm being realistic about it...

My New Years resolution is to sob uncontrollably long into the night and blame it on stray dogs"	Wilmington, De	Eastern Time (US & Canada)	Tue Dec 31 21:04:52 +0000 2013
418125629205512193	"New Years resolution 
• look older than 12"	London	Casablanca	Tue Dec 31 21:04:53 +0000 2013
418125630106898432	"I think my New Years resolution is the easiest... 

Gain weight. Hahahaha"			Tue Dec 31 21:04:53 +0000 2013
418125630606409728	@BuryJessica @ljbieber38 @favendano610  yea whatever ur ugly and your New Years resolution is to get a bf and stop lookin like a man bye	unknown	Hawaii	Tue Dec 31 21:04:53 +0000 2013
418125630996480000	My new years resolution is to make this sarcastic asshole tweet about how nobody cares about your resolution.			Tue Dec 31 21:04:53 +0000 2013
418125632816439296	my new years resolution is to hate less people and have less people hate me		Atlantic Time (Canada)	Tue Dec 31 21:04:53 +0000 2013
418125637757313025	Does anyone have a New Years resolution for their farming operation? Ours is to manage our time more efficiently.	NC Illinois		Tue Dec 31 21:04:55 +0000 2013
418125637975814144	"When people say my New Years resolution is to get in shape, I eyeball them and say ""are you really, because I actually held my resolution"""		Eastern Time (US & Canada)	Tue Dec 31 21:04:55 +0000 2013
418125639867457536	My new years resolution is to be the best mommy I can be and to love everyone who loves me unconditionally	IG: mojaay66nxc	Eastern Time (US & Canada)	Tue Dec 31 21:04:55 +0000 2013
418125643352514560	My new years resolution is not to get kicked in the face by a kangaroo. #4YearsInARow			Tue Dec 31 21:04:56 +0000 2013
418125646204657664	New Years is in 8 more hours so let's all make a new years resolution			Tue Dec 31 21:04:57 +0000 2013
418125646523797505	My very main New Years resolution is to meet new people and make new friends :)	.		Tue Dec 31 21:04:57 +0000 2013
418125648100855808	I've already given up on my new years resolution	NJ		Tue Dec 31 21:04:57 +0000 2013
418125648851259392	My New Years resolution is to stop all the pollution, talk to muth'fuckin much, I got my drink I got my music. 💀💫🎶		Indiana (East)	Tue Dec 31 21:04:57 +0000 2013
418125651221032960	New Years Resolution: Bring back the 80's hair rat tail	DFW,TX	Central Time (US & Canada)	Tue Dec 31 21:04:58 +0000 2013
418125657223487488	My new years' resolution is to spend more time with the ones I care about ♥ And less time worrying about the ones who don't care about me..	Essex	Casablanca	Tue Dec 31 21:04:59 +0000 2013
418125657432813568	My New Years resolution is going to be telling other people what their resolutions should be		Central Time (US & Canada)	Tue Dec 31 21:04:59 +0000 2013
418125658297225216	New Years resolution: keep living life exactly the same as I did all of 2013 #simple #happy #healthy		Atlantic Time (Canada)	Tue Dec 31 21:04:59 +0000 2013
418125659144089600	My New Years resolution eat more pizza🍕			Tue Dec 31 21:05:00 +0000 2013
418125659781611520	New Years resolution: I'm a quit takin niggas bitches 😂😂😂	mile high	Arizona	Tue Dec 31 21:05:00 +0000 2013
418125660540768257	New Years resolution: take more naps.		Eastern Time (US & Canada)	Tue Dec 31 21:05:00 +0000 2013
418125661002145792	Dont let these haters make you feel bad because you got a new years resolution, if you got one just stick to it		Eastern Time (US & Canada)	Tue Dec 31 21:05:00 +0000 2013
418125663682703360	New Years resolution: be nice to people	Boston, Ma	Pacific Time (US & Canada)	Tue Dec 31 21:05:01 +0000 2013
418125672674906112	I have a New Years resolution and when I achieve it ... you will know! ;)		Arizona	Tue Dec 31 21:05:03 +0000 2013
418125673874481152	My New Years resolution is to start eating healthy......... oh wait I forgot my french fries in the microwave............ lol just kidding!!	I live with my neighbours.		Tue Dec 31 21:05:03 +0000 2013
418125674855936000	And btw I don't have a new years resolution bcz I am perfect. #Boss #KingAgam thank you very much :$	United Arab Emirates/Dubai	Abu Dhabi	Tue Dec 31 21:05:03 +0000 2013
418125677012201472	My New Years resolution is to not fall in love this year let's see how long this lasts.			Tue Dec 31 21:05:04 +0000 2013
418125678081355776	New Years resolution? The same as every year! Stay awesome! 😎		Pacific Time (US & Canada)	Tue Dec 31 21:05:04 +0000 2013
418125679365218304	New years resolution finish my FUCKIN culminatings			Tue Dec 31 21:05:05 +0000 2013
418125682837684224	My mom gave me a New Years resolution to be a nicer person😂 okay momma		Pacific Time (US & Canada)	Tue Dec 31 21:05:05 +0000 2013
418125684397965312	I can't remember the last time i made an actual new years resolution		Arizona	Tue Dec 31 21:05:06 +0000 2013
418125685782511616	@ladygaga it was to party when they heal in 2013; what is your new years resolution for 2014?!	Kuwait City	Kuwait	Tue Dec 31 21:05:06 +0000 2013
418125686189355008	Have to go back to Ibiza next year!! That my New Years resolution	brighton , uk		Tue Dec 31 21:05:06 +0000 2013
418125690165542912	"I have a New Years resolution for some of these toons:

Be less fuckin annoying"		Eastern Time (US & Canada)	Tue Dec 31 21:05:07 +0000 2013
418125694829199360	My New Years resolution is to be the same person I have always been I don't need to change for 2014	pittsburgh pa 4⃣1⃣✌	Atlantic Time (Canada)	Tue Dec 31 21:05:08 +0000 2013
418125694854393856	“@Berg_sauce2: New Years resolution Is to stop wasting my time on people who don't deserve it 👌”	O'Fallon, MO	Eastern Time (US & Canada)	Tue Dec 31 21:05:08 +0000 2013
418125695567400960	New Years resolution: Finally nail that Cutback-Drop-Turn.	私はアニメ大好きです。日本語を勉強しています	Eastern Time (US & Canada)	Tue Dec 31 21:05:08 +0000 2013
418125697953980416	@Father_Ysa my New Years resolution is to be sassiest in all of my classes			Tue Dec 31 21:05:09 +0000 2013
418125701171011584	My new years resolution was gonna be to shave my legs more often but why set myself up for failure	Naperville, Illinois		Tue Dec 31 21:05:10 +0000 2013
418125707332444160	“@x0annamarie: Robert started his new years resolution like a couple days ago”foo shut up ya kno I'm playn	a hot ass valley	Pacific Time (US & Canada)	Tue Dec 31 21:05:11 +0000 2013
418125707764457472	New Years Resolution: Be 6 ft tall. No? Maybe 2015 then...	Tally	Eastern Time (US & Canada)	Tue Dec 31 21:05:11 +0000 2013
418125714831851520	My New Years resolution is to make sure none of you achieve yours.	Los Angeles, CA	Pacific Time (US & Canada)	Tue Dec 31 21:05:13 +0000 2013
418125716539338752	DR DRE'S New Years resolution should be to STOP HIDING IN THE CUT.	HOMELAND	Pacific Time (US & Canada)	Tue Dec 31 21:05:13 +0000 2013
418125716966744065	"i have seen so many people tweet ""New Years resolution: party more"" but mine is to become closer with god this year #comeonguys 😒"		Eastern Time (US & Canada)	Tue Dec 31 21:05:13 +0000 2013
418125717604290560	New years resolution #1: stop breaking cars...	Wisconsin	Eastern Time (US & Canada)	Tue Dec 31 21:05:14 +0000 2013
418125718992994304	Possible New Years resolution #2, burn all bridges. Not the emotional kind. Physical ones.	Chicago, Illinois	Eastern Time (US & Canada)	Tue Dec 31 21:05:14 +0000 2013
418125719869222912	My New Years resolution is to fangirl more and do school less		Arizona	Tue Dec 31 21:05:14 +0000 2013
418125720582631424	New Years Resolution: follow through with my other New Years resolutions.			Tue Dec 31 21:05:14 +0000 2013
418125724801699840	New Years Resolution: 6pac and before Spring break	Indianapolis, Indiana		Tue Dec 31 21:05:15 +0000 2013
418125726231965696	Today I bought a couple packs of cigarettes and started chain smoking. So my New Years Resolution will be to quit smoking cold turkey		Atlantic Time (Canada)	Tue Dec 31 21:05:16 +0000 2013
418125731349012480	There better not be a new years resolution assignment once we get back.	Pico Rivera, CA	Pacific Time (US & Canada)	Tue Dec 31 21:05:17 +0000 2013
418125732343078912	I have 3 hours to think of a new years resolution	England	Amsterdam	Tue Dec 31 21:05:17 +0000 2013
418125736441303040	Fuck the club, fuck everyone that's my new years 'resolution'	Ireland	Amsterdam	Tue Dec 31 21:05:18 +0000 2013
418125736453885952	New Years Resolution: cut out the fake friends and people that bring me down #peaceoutbitches ✌️👋			Tue Dec 31 21:05:18 +0000 2013
418125736730312704	as i mentioned before, my new years resolution is to be dead. hasta la vista chumps	rockford, illinois	Mountain Time (US & Canada)	Tue Dec 31 21:05:18 +0000 2013
418125736776454144	"""@soul0ho3 What's your New Years resolution?"" fuck different race women just to see my dick in em"	perdido en pensamiento	Alaska	Tue Dec 31 21:05:18 +0000 2013
418125737527218176	My cousin new years resolution is to continue getting money &amp; being basic.		Central Time (US & Canada)	Tue Dec 31 21:05:18 +0000 2013
418125737871155200	@vbdrywaller not a chance new years resolution #1 get back dancing title at Ikea...#2 get rusty fired up about Crean lol			Tue Dec 31 21:05:18 +0000 2013
418125738521657345	My new years resolution is gonna be like every year, more VIDEO GAMES MUST BE PLAYED.	Unstuck In Time	Eastern Time (US & Canada)	Tue Dec 31 21:05:19 +0000 2013
418125738718412800	Fulfilling my 2013 New Years resolution by ending it with a bang. Lol, let's just hope I survive tomorrow to make some for 2014.			Tue Dec 31 21:05:19 +0000 2013
418125744376537088	New Years resolution- drink better wine			Tue Dec 31 21:05:20 +0000 2013
418125744531730432	My New Years resolution is to become a sea cucumber.		Pacific Time (US & Canada)	Tue Dec 31 21:05:20 +0000 2013
418125744779571200	@TonyF87 &lt;obligatory New Years resolution joke here&gt;	Wantown	Edinburgh	Tue Dec 31 21:05:20 +0000 2013
418125745760653312	"The New Years resolution is......

Instead of giving a shit; I'll just take one."			Tue Dec 31 21:05:20 +0000 2013
418125747296153600	New Years resolution get @KalinWhite to follow me😩xx	black and yellow	Central Time (US & Canada)	Tue Dec 31 21:05:21 +0000 2013
418125750135709696	My new years resolution for 2014 is to not trust a single soul until my trust is earned		Central Time (US & Canada)	Tue Dec 31 21:05:21 +0000 2013
418125750265729025	Even if I made a New Years resolution, I would forget it by tonight. Soooo fuck it. #NYE #Truth	London, UK	London	Tue Dec 31 21:05:21 +0000 2013
418125750756052992	my New Years resolution is suppose to be to lose weight, I never do but to make me feel better I say that #fatpplprpbz #imgettingicecream	LA/NY/GB		Tue Dec 31 21:05:22 +0000 2013
418125751381008385	new years resolution: to not crack my phone screen and to not let my hypochondria get the best of me	in the 305	Central Time (US & Canada)	Tue Dec 31 21:05:22 +0000 2013
418125751779487745	@croftpointoh @KyraMendoza hahaha New Years resolution? I'll read it after			Tue Dec 31 21:05:22 +0000 2013
418125755206221824	My new years resolution is going to be to make better plans for new years 2015. #lemmon party	OXfurd, Sipp		Tue Dec 31 21:05:23 +0000 2013
418125757462749185	My New Years resolution is to get tweeted by @RobbieKay_  :) lol	Wisconsin	Eastern Time (US & Canada)	Tue Dec 31 21:05:23 +0000 2013
418125761174704128	My new years resolution is to get a full sex change by next year	Chicago, IL	Mountain Time (US & Canada)	Tue Dec 31 21:05:24 +0000 2013
418125763187970048	Happy New Year, we hope you're making your 2014 New Years Resolution to #visithardy often!!!	Hardy County, WV	Eastern Time (US & Canada)	Tue Dec 31 21:05:25 +0000 2013
418125765209628672	New years resolution coming later. I still need to get issue #4 scripted before the ball drops tonight.			Tue Dec 31 21:05:25 +0000 2013
