id	text	location	time_zone	date
418127079616823296	bye im going to write my new years resolution	zero/5	Bucharest	Tue Dec 31 21:10:38 +0000 2013
418127081889726464	@JPTooCold3277 mmh baby you're my new years resolution❤	⚓ neverland♡ #theFamily		Tue Dec 31 21:10:39 +0000 2013
418127085329469440	"New Years Resolution: never again utter the word #selfie - henceforth, I shall only refer to as ""handheld self-portraits."""			Tue Dec 31 21:10:40 +0000 2013
418127085886898176	My resolution for New Years is... NIGGA WE MADE IT!	SF/LA/CLVND		Tue Dec 31 21:10:40 +0000 2013
418127086042107904	People will have a New Years resolution, follow it for one day, &amp; go back to the way they were😂		Central Time (US & Canada)	Tue Dec 31 21:10:40 +0000 2013
418127085727932416	@MattHDGamer you should have a New Years resolution to give up bourbons and Dr Pepper lol :)	Liverpool FC		Tue Dec 31 21:10:40 +0000 2013
418127089129123840	New years resolution is my only motivation to revise.	Sandhurst	London	Tue Dec 31 21:10:41 +0000 2013
418127091495108608	I NEED A NEW YEARS RESOLUTION	Instagram - robynodwyerr		Tue Dec 31 21:10:41 +0000 2013
418127093424472065	my new years resolution, don't associate with people that eat with your enemies		Eastern Time (US & Canada)	Tue Dec 31 21:10:42 +0000 2013
418127097060937729	My New Years resolution is to see YOU at #SapphireNewYork!!!  Doors open at 8pm tonight, start 2014 with a lap dance ;)	New York City	Eastern Time (US & Canada)	Tue Dec 31 21:10:43 +0000 2013
418127103486599168	"""@floweryniaIl: QUOTE THIS WITH UR NEW YEARS RESOLUTION 

Don't ignore this ik everyone has one :))"" exercise more often &amp; drink less pop -B"	4/4 & 5/5 Canada	Atlantic Time (Canada)	Tue Dec 31 21:10:44 +0000 2013
418127104031465472	New Years resolution: Stronger, faster, smarter, being more aware, and putting as much work as I can into my game		Arizona	Tue Dec 31 21:10:44 +0000 2013
418127109777653760	You moving was not on my New Years Resolution list!👎💦😡😞			Tue Dec 31 21:10:46 +0000 2013
418127109790633984	Actually my New Years resolution is not to fuck up tweets.	Vermont City, VT	Quito	Tue Dec 31 21:10:46 +0000 2013
418127111023362048	My New Years resolution is to find a not creepy mattress store (for a friend)	retirement	Eastern Time (US & Canada)	Tue Dec 31 21:10:46 +0000 2013
418127111371513856	New Years resolution is to work my ass of to get another scholly 😏⚡️			Tue Dec 31 21:10:46 +0000 2013
418127112428847104	Does your new years resolution involve doing more yoga? Tomorrow we are offering a one-day-only special: $31 for 31 days of unlimited yoga!	Cambridge/Somerville, MA	Atlantic Time (Canada)	Tue Dec 31 21:10:46 +0000 2013
418127113473261568	My New Years resolution is to see YOU at #SapphireNewYork!!!  Doors open at 8pm tonight, start 2014 with a lap dance ;)	New York City	Eastern Time (US & Canada)	Tue Dec 31 21:10:46 +0000 2013
418127114865364992	"my new years resolution isnt actually getting 1/5.
im just happy that our boys are alive bc some peoples idols arent even alive anymore."	holland	Greenland	Tue Dec 31 21:10:47 +0000 2013
418127114261770240	My new years resolution is to stop all the pollution talk too mother fucking much I got my drink I got my music		Central Time (US & Canada)	Tue Dec 31 21:10:47 +0000 2013
418127116488560640	@BitchSwag_69 you need to work on your sarcasm skills, make that your new years resolution #1 haha	sinners paradise, NV	Arizona	Tue Dec 31 21:10:47 +0000 2013
418127117641990145	My New Years resolution is to start shaving my legs more often		Hawaii	Tue Dec 31 21:10:47 +0000 2013
418127118883516416	Just fixed another iPhone... My New Years resolution for 2014 is to make the whole year without going for big number 12 #wooohoooo	TEXAS	Central Time (US & Canada)	Tue Dec 31 21:10:48 +0000 2013
418127118892290048	"""My New Years resolution is to be sexy and sassy"" -Emma"		Atlantic Time (Canada)	Tue Dec 31 21:10:48 +0000 2013
418127119147737088	My New Years Resolution- pass my fucking drivers test, for gods sake.	#TheDirtyThreeThirty		Tue Dec 31 21:10:48 +0000 2013
418127119315906561	Mike just called me not skinny. And now his New Years resolution is to think before he speaks. 😂😂	Ontario	Central Time (US & Canada)	Tue Dec 31 21:10:48 +0000 2013
418127119462318080	“@prettychels__: fuck yo new years resolution nigga🔫” 🙌	Smoking With The Devil	Eastern Time (US & Canada)	Tue Dec 31 21:10:48 +0000 2013
418127121631166464	Can I recommend a New Years resolution for my ex? Stop texting me.	WV/NH	Central Time (US & Canada)	Tue Dec 31 21:10:48 +0000 2013
418127123929657344	My New Years Resolution is to continue being the fine young man I am. I'm already too fucking awesome to make changes.	Pennsylvania	Eastern Time (US & Canada)	Tue Dec 31 21:10:49 +0000 2013
418127124235448320	I gotta think of a New Years resolution	N.O-----BR	Pacific Time (US & Canada)	Tue Dec 31 21:10:49 +0000 2013
418127123917058049	my new years resolution is to kill more favs		Atlantic Time (Canada)	Tue Dec 31 21:10:49 +0000 2013
418127125229887488	"New Years Resolution:
Make Dylan O'Brien love me"	Chicago	Central Time (US & Canada)	Tue Dec 31 21:10:49 +0000 2013
418127125531852801	There really ain't shit stupid about makin a New Years Resolution. It's giving your mind a reason to say today's the day to start.	Puerto Rico ✈ DMV ✈ Cville	Central Time (US & Canada)	Tue Dec 31 21:10:49 +0000 2013
418127125972258816	My New Years resolution is just to create happiness for myself	queens ,new york	Central Time (US & Canada)	Tue Dec 31 21:10:49 +0000 2013
418127126403891200	Fuck yeah my New Years resolution is to move the fuck out of my parents house lmao	l0/5er	Quito	Tue Dec 31 21:10:50 +0000 2013
418127126987300865	My New Years resolution is to marry @elliegoulding #NYE	in the mouth of a lion	Quito	Tue Dec 31 21:10:50 +0000 2013
418127127725481984	New years resolution is something that I'm taking seriously this year.	Traveling with Carmen Sandiego		Tue Dec 31 21:10:50 +0000 2013
418127130682490880	New years resolution: eat more goldfish 😍 #addicting	Tampa to Tuscaloosa		Tue Dec 31 21:10:51 +0000 2013
418127131189579776	I remember i had a new years resolution paper from like 5 years ago that said get better grades, still working on that one though 😂	akron		Tue Dec 31 21:10:51 +0000 2013
418127134352109568	Trying to remember what my New Years resolution was last year...			Tue Dec 31 21:10:51 +0000 2013
418127139565629440	New Years resolution be Japanese	zora domain	Quito	Tue Dec 31 21:10:53 +0000 2013
418127140182167552	My New Years resolution is to STOP 🙅 fucking w/ these phony ass ppl &amp; stick w/ my real b*tches 👌💯😝	Pittsburgh ✈️ Texas	Central Time (US & Canada)	Tue Dec 31 21:10:53 +0000 2013
418127140131831808	I'm going to think of a really good new years resolution sometime later. #ProcrastiNation	Mass	Atlantic Time (Canada)	Tue Dec 31 21:10:53 +0000 2013
418127141130469376	My New Years resolution is to make sure I spend the next one with my baby🙈 #newyearskissvirgin			Tue Dec 31 21:10:53 +0000 2013
418127145131847680	New years resolution : never fly el al again.	London.	Amsterdam	Tue Dec 31 21:10:54 +0000 2013
418127146788618240	@ASVP_Kimmi its my new years resolution, dang!	Philly		Tue Dec 31 21:10:54 +0000 2013
418127152924880896	All I want to do for my new years resolution is get more social	Run For Your Lives!	Casablanca	Tue Dec 31 21:10:56 +0000 2013
418127153746563073	new years resolution: become a douchebag	under your bed.	Quito	Tue Dec 31 21:10:56 +0000 2013
418127161275330560	"My mom : Denise what's your New Years resolution ? 
Me: to not be jakes bitch -.- @SheLovesMyGanja"			Tue Dec 31 21:10:58 +0000 2013
418127164891217920	I've never actually had a New Years Resolution	Awkwardville	Eastern Time (US & Canada)	Tue Dec 31 21:10:59 +0000 2013
418127169211363328	If your New Years resolution is to join a gym to satisfy yourself for a few weeks DON'T! Don't need the extra bodies on machines. #StayAway	VA		Tue Dec 31 21:11:00 +0000 2013
418127169978527744	New Years Resolution: I will be in the same room as Beyonce at one point in 2014		Eastern Time (US & Canada)	Tue Dec 31 21:11:00 +0000 2013
418127170482221056	@emILYmariee15 New Years resolution?		Quito	Tue Dec 31 21:11:00 +0000 2013
418127171656224768	My New Years resolution is to take more naps in @themikaylakohls bed. The sleep gods want me to.	Brooklyn Park	Mountain Time (US & Canada)	Tue Dec 31 21:11:00 +0000 2013
418127174122483712	New years resolution to make Italy happy in any way I can since we all know Germany is gonna make him sad one way or another&lt;3	not in a grave	Central Time (US & Canada)	Tue Dec 31 21:11:01 +0000 2013
418127174952951809	My only New Years resolution is to not f up every good thing that happens to me this year.		Hawaii	Tue Dec 31 21:11:01 +0000 2013
418127176459108352	“@SHAD_GMD: @allwhite_brickz rs bra fuk they new years resolution”			Tue Dec 31 21:11:01 +0000 2013
418127178430418944	My New Years resolution is to find what is best for me &amp; to pursue it. No need to pursue people or things that hold me back/make me unhappy.		Atlantic Time (Canada)	Tue Dec 31 21:11:02 +0000 2013
418127179105730560	My New Years Resolution: eat healthy and be healthy. #needtobeskinny lmfao		Eastern Time (US & Canada)	Tue Dec 31 21:11:02 +0000 2013
418127186319536128	“@thatjlawtho: New Years resolution: be Jennifer Lawrence” 🙌😍👌		Arizona	Tue Dec 31 21:11:04 +0000 2013
418127186571591680	@caitlinielsen new years resolution: to eat better and also to try everything on the McDonalds and taco bell menu	clearwater	Central Time (US & Canada)	Tue Dec 31 21:11:04 +0000 2013
418127196092260352	My New Years resolution is the same as the last 24 years. Don't piss myself	Saskatoon, Saskatchewan,Canada	Mountain Time (US & Canada)	Tue Dec 31 21:11:06 +0000 2013
418127197279232000	Ugh I have no new years resolution. My ass doesnt change for anyone or anything especially a new year. Womp.	indio, CALIFORNIA	Pacific Time (US & Canada)	Tue Dec 31 21:11:06 +0000 2013
418127199854927873	grandma says my New Years resolution should be to stop drinking lol #tryagain		Central Time (US & Canada)	Tue Dec 31 21:11:07 +0000 2013
418127200731529216	My New Years resolution is to prosper and that's all	everywhere and nowhere		Tue Dec 31 21:11:07 +0000 2013
418127201066684416	@uyokw my new years resolution: to die		London	Tue Dec 31 21:11:07 +0000 2013
418127202081730560	My New Years resolution is to make it to 2015. Aim low, my friends, and you'll never be disappointed.	Scenic Nowhere, Utah	Pacific Time (US & Canada)	Tue Dec 31 21:11:08 +0000 2013
418127201968848896	New Years resolution not to shank any punts			Tue Dec 31 21:11:08 +0000 2013
418127211804114944	my new years resolution is to keep a journal and write down all my adventures this year	city of angels	Eastern Time (US & Canada)	Tue Dec 31 21:11:10 +0000 2013
418127212009623552	Everybody already know my New Years resolution			Tue Dec 31 21:11:10 +0000 2013
418127213381566465	New Years resolution: for @grantlandis to follow me😍😍💋💋			Tue Dec 31 21:11:10 +0000 2013
418127214778277888	My New Years resolution is to lose weight .		Eastern Time (US & Canada)	Tue Dec 31 21:11:11 +0000 2013
418127215713591296	My New Years Resolution is to make-out with Tess Renfro. #LesgoesLEZ	Lesley '17	Eastern Time (US & Canada)	Tue Dec 31 21:11:11 +0000 2013
418127216191766529	Here's a New Years resolution! Wipe down the equipment after your sorry excuse of a sweat ball uses it.	Charleston, South Carolina	Eastern Time (US & Canada)	Tue Dec 31 21:11:11 +0000 2013
418127216195952642	&amp; my resolution for New Years is nigga we made it!!			Tue Dec 31 21:11:11 +0000 2013
418127218418515968	“@I_Campbell3: And my resolution for New Years is we made it”You don't know how long I waited I coulda been waitin on tables my karma amazin	Outchea		Tue Dec 31 21:11:11 +0000 2013
418127219471695872	Making New Years resolution but don't think I can do it :( like doin all homework on time and not at lunch or in class that's the hardest	Canada		Tue Dec 31 21:11:12 +0000 2013
418127221992472576	"So my Mothers ask me""what's ur new years resolution?"" n m lyk ""I'm getting a new phone, Samsung S4 possibly"" I'm sure she regrets asking me☺"	Cape Town| Port Elizabeth		Tue Dec 31 21:11:12 +0000 2013
418127226740039680	New Years resolution: more strongly consider being a nudist	Tacoma, Washington		Tue Dec 31 21:11:13 +0000 2013
418127228812414976	can I make my New Years resolution to meet harry styles		Eastern Time (US & Canada)	Tue Dec 31 21:11:14 +0000 2013
418127229386620928	People are making New Years resolutions but what's your resolution for just today? Doing now is much more important than in the future.		Pacific Time (US & Canada)	Tue Dec 31 21:11:14 +0000 2013
418127229999415296	My new years resolution is to not make any resolutions so then I won't get upset if I break them 😋	Kent England	Amsterdam	Tue Dec 31 21:11:14 +0000 2013
418127232662786048	“@KaylaMarieex3: My New Years resolution is just to create happiness for myself”	temporary forevers	Hawaii	Tue Dec 31 21:11:15 +0000 2013
418127234579574784	My New Years resolution is to learn how to dance like Beyoncé by watching her music videos	Yorkshire		Tue Dec 31 21:11:15 +0000 2013
418127239931117569	NEW YEARS RESOLUTION: To be more efficient!	Wilmington, NC		Tue Dec 31 21:11:17 +0000 2013
418127240019202049	My New Years Resolution is simple. Make 2014 suck less than 2013.	33.437936,-111.99914	Quito	Tue Dec 31 21:11:17 +0000 2013
418127243614101504	My New Years resolution is not to get fucked over by some bitch			Tue Dec 31 21:11:17 +0000 2013
418127247648632832	my new years resolution is to not fuck up every phone I get within the first 48 hrs of getting it	Noblesville/Evansville	Quito	Tue Dec 31 21:11:18 +0000 2013
418127247774461952	@that_hillaree @2014callie your New Years resolution setting you up for failure😱😱✋	Psalm 119:105	Eastern Time (US & Canada)	Tue Dec 31 21:11:18 +0000 2013
418127249066319874	New Years Resolution for politicians... This year I will answer the questions I am asked.	Bendigo, Australia	Melbourne	Tue Dec 31 21:11:19 +0000 2013
418127248966029312	My resolution for New Years is....	Tallahassee	Eastern Time (US & Canada)	Tue Dec 31 21:11:19 +0000 2013
418127249296998401	New Years resolution to let italy to do whatever he wants :-) instead of trying to steal him :--)		Hawaii	Tue Dec 31 21:11:19 +0000 2013
418127251205791744	got my New Years resolution all planned out 😌		Atlantic Time (Canada)	Tue Dec 31 21:11:19 +0000 2013
418127251142901760	My New Years resolution is to get fit and thinner, same every year but this time I have motivation on my side	England	Amsterdam	Tue Dec 31 21:11:19 +0000 2013
418127251415531520	I don't think I've ever met someone who went through with a New Years resolution.	The Doghouse	Atlantic Time (Canada)	Tue Dec 31 21:11:19 +0000 2013
418127253428383744	New years resolution: never have a new years resolution because they're stupid and unrealistic.	Winnipeg, Manitoba, Canada		Tue Dec 31 21:11:20 +0000 2013
418127253709402112	"My New Years resolution is

-to be skinny
-to be pretty
-to have a bf

God: fuck that ha"		Athens	Tue Dec 31 21:11:20 +0000 2013
418127255320023040	My new years resolution is to get my shit together and I think that covers every aspect of my life so			Tue Dec 31 21:11:20 +0000 2013
418127255500783616	my New Years resolution is to move somewhere fun	blue mountain state	Quito	Tue Dec 31 21:11:20 +0000 2013
418127256880287744	"New Years resolution: 
To never lose myself again. Learn from my past. Find something each day to inspire me for the next 🙌"		Arizona	Tue Dec 31 21:11:21 +0000 2013
418127259505934336	Far too much camo and/or UK apparel sightings in the Jeffersonville Meijers today. Let's make it a New Years resolution for camo to stop.		Quito	Tue Dec 31 21:11:21 +0000 2013
418127259124264960	"And My Resolution 4 New Years Is, 

""Nigha, We Made It!"" 🙌"	Los Angeles.	Central Time (US & Canada)	Tue Dec 31 21:11:21 +0000 2013
418127261834158080	My New Years resolution is to stop being a procrastinator! Legit the worst		Atlantic Time (Canada)	Tue Dec 31 21:11:22 +0000 2013
418127262643666944	My New Years resolution is to talk to more mixers because I feel like I could make new best friends but I just get nervous xxx	♡Ariana&UnionJ♡	London	Tue Dec 31 21:11:22 +0000 2013
418127264879239168	I always make a New Years resolution &amp; never follow through with it	Canada		Tue Dec 31 21:11:23 +0000 2013
418127271472279553	My New Years Resolution is receive endless amounts of Ferrero Chocolates. #NewYearsResolution	Minnesota.	Central Time (US & Canada)	Tue Dec 31 21:11:24 +0000 2013
418127273837862914	My New Years resolution is to start shaving my legs on a regular basis.. Should probably not let them grow out like a man anymore...	SD↔SB	Arizona	Tue Dec 31 21:11:25 +0000 2013
418127275016863744	new years resolution never works out for me smh	New Jersey		Tue Dec 31 21:11:25 +0000 2013
418127275104948224	My New Years resolution darling.. To have more fun!	London		Tue Dec 31 21:11:25 +0000 2013
418127276447133696	I kept my New Years resolution from last year. 💟 365 days strong.		Buenos Aires	Tue Dec 31 21:11:25 +0000 2013
418127277826658304	My new years resolution is to be a better person and a better friend that's all.			Tue Dec 31 21:11:26 +0000 2013
418127283560251393	New Years Resolution: Drink more Jones Soda @jonessodaco	b/t a sauce pan & a breadroll		Tue Dec 31 21:11:27 +0000 2013
418127285984575488	My New Years Resolution is to get serious	WKRP In Cincinnati	Eastern Time (US & Canada)	Tue Dec 31 21:11:28 +0000 2013
418127288589238272	New Years resolution make the count down lmao #round4 #onemorenomore @mercedeskeshane	Regina, Saskatchewan	Mountain Time (US & Canada)	Tue Dec 31 21:11:28 +0000 2013
418127289608458240	My New Years resolution is to make more money.		Pacific Time (US & Canada)	Tue Dec 31 21:11:28 +0000 2013
418127290435125248	my New Years resolution is to appreciate any good thing that enters my life. that's the thing I ever fuck up on and I'll never do it again!	Kettering		Tue Dec 31 21:11:29 +0000 2013
418127290988371968	So my New Years Resolution was to not be so annoying to others. How'd i do?	da mitten ✋		Tue Dec 31 21:11:29 +0000 2013
418127291131392000	My new years resolution is to not snapchat or tweet during school but we all know I failed that already.			Tue Dec 31 21:11:29 +0000 2013
418127291378434048	New Years resolution: Buy myself flowers at least once a month. 💐🌸🌹🌻🌷 #selfcare	Eugene, OR		Tue Dec 31 21:11:29 +0000 2013
418127294633631744	"""You will be assigned a New Years' resolution if you do not choose one yourself."" - it's bare fun at our house tonight hahahha @tashaontoast"	Warrington	Amsterdam	Tue Dec 31 21:11:30 +0000 2013
418127294881083392	New years resolution: be as inspirational as @EmblemThree! #bandlifetour2014 #teaminspire #loveyouall #follow?	Pennsylvania	Atlantic Time (Canada)	Tue Dec 31 21:11:30 +0000 2013
418127295908700160	A good New Years resolution is to have pictures taken #newyear			Tue Dec 31 21:11:30 +0000 2013
418127296394846208	No New Years resolution for me.. I'm not mad at anyone doing one though, you shouldn't be either. Let people live..	Oxygen City	Pacific Time (US & Canada)	Tue Dec 31 21:11:30 +0000 2013
418127297472778240	My New Years Resolution is to make you smile	Hilliard Ohio	Eastern Time (US & Canada)	Tue Dec 31 21:11:30 +0000 2013
418127299612254209	@LOBOisthemotto that should be ur new years resolution haha	underneath your bed		Tue Dec 31 21:11:31 +0000 2013
418127300094615552	My New Years resolution is to take some cock in the ass	Worcester	Casablanca	Tue Dec 31 21:11:31 +0000 2013
418127300413378560	New Years resolution #2 I'm going to stop being picky and not just limit myself to just Christian women.	New York	Eastern Time (US & Canada)	Tue Dec 31 21:11:31 +0000 2013
418127300732141568	New Years Resolution for 2014 - be a bigger cunt than I was in 2013,difficult but I'll give it a good go!	Burnley	Casablanca	Tue Dec 31 21:11:31 +0000 2013
418127301298372608	your New Years resolution should be to try and not be a cunt	private drive	Casablanca	Tue Dec 31 21:11:31 +0000 2013
418127302816714752	My New Years resolution is to lose my virginity.		Casablanca	Tue Dec 31 21:11:32 +0000 2013
418127304607289344	I really want to see someone stick to a new years resolution	Texas	Alaska	Tue Dec 31 21:11:32 +0000 2013
418127306142810112	New Years resolution - read less. Books are dull.			Tue Dec 31 21:11:32 +0000 2013
418127306402836480	New years resolution = Become more successful in my Football and one step closer to professionalism #2014 #HereWeGo	Cape Town, South Africa	Athens	Tue Dec 31 21:11:32 +0000 2013
418127308482813953	@GIBAM_Movement my New Years resolution is to become a better man for my son and fiancé		Pacific Time (US & Canada)	Tue Dec 31 21:11:33 +0000 2013
418127310181892096	My resolution for New Years is NIGGA WE MADE IT	uptown, philly	Quito	Tue Dec 31 21:11:33 +0000 2013
418127311721230336	My New Years resolution will involve some type of fitness.	Chattanooga, TN	Atlantic Time (Canada)	Tue Dec 31 21:11:34 +0000 2013
418127313361190913	New Years Resolution: To continue not loving these hoes	VA	Atlantic Time (Canada)	Tue Dec 31 21:11:34 +0000 2013
418127313687953408	New Years resolution eat more pizza	zora domain	Quito	Tue Dec 31 21:11:34 +0000 2013
418127313847734273	My New Years resolution is to cut down on my vegetables	Wrexham	Casablanca	Tue Dec 31 21:11:34 +0000 2013
418127314359435264	my new years resolution is to have more sex and do more drugs		Casablanca	Tue Dec 31 21:11:34 +0000 2013
418127315110199296	New years resolution : kick a dumbass in the balls and spit on his head	South Africa		Tue Dec 31 21:11:35 +0000 2013
418127318981574656	New Years resolution- get a girlfriend			Tue Dec 31 21:11:35 +0000 2013
418127318989950976	No need for me to have a new years resolution im just gunna get shitfaced #justanotherday #fuckthat	Pennsylvania	Eastern Time (US & Canada)	Tue Dec 31 21:11:35 +0000 2013
418127319488675840	"The only New Years resolution I have for the year is to stop biting my nails. 
I've had this resolution for awhile now."		Central Time (US & Canada)	Tue Dec 31 21:11:36 +0000 2013
418127323313864704	Fuck a New Years resolution I'll be on the same shit in 2014			Tue Dec 31 21:11:36 +0000 2013
418127326204162049	Been one crazy past few months, don't know what's got in to me, New Years resolution is to calm the fuck down😂👍		Amsterdam	Tue Dec 31 21:11:37 +0000 2013
418127325998223360	For your new years resolution, try to.stop being such a whore @KayBabyGeee			Tue Dec 31 21:11:37 +0000 2013
418127328070225920	after tomorrow, if I don't talk to you anymore... you'll know what my new years resolution was #bye		Hawaii	Tue Dec 31 21:11:38 +0000 2013
418127329743761409	"new years resolution? more like ""do it for a week than quit"""		Quito	Tue Dec 31 21:11:38 +0000 2013
418127331325001730	My new years resolution is to be more assertive ! To Worry about making this money for me and mines. 03-01	Minnesota	Arizona	Tue Dec 31 21:11:38 +0000 2013
418127333497659392	New Years resolution: get out of bed		Pacific Time (US & Canada)	Tue Dec 31 21:11:39 +0000 2013
418127333334478850	Couldn't care less about the New Years resolution! I'm glad Christmas is over	Ireland	Casablanca	Tue Dec 31 21:11:39 +0000 2013
418127333879742464	My resolution is to not have anything worth resolving for the next New Years	Hamden, Connecticut	Atlantic Time (Canada)	Tue Dec 31 21:11:39 +0000 2013
418127334781485057	New Years Resolution: Box @BobbyGiuffreda and win	Maryland.	Atlantic Time (Canada)	Tue Dec 31 21:11:39 +0000 2013
418127336777601024	Zoua wants us to start working out more for our New Years resolution.. I get tired watching her work out, how am I supposed to join her?! 😒		Central Time (US & Canada)	Tue Dec 31 21:11:40 +0000 2013
418127338597920768	"STOP MAKING YOUR NEW YEARS RESOLUTION ""TO LOSE WEIGHT"" IF YOU'VE FAILED IT 7 YEARS IN A ROW."	Goldenrod City	Eastern Time (US & Canada)	Tue Dec 31 21:11:40 +0000 2013
418127344650309632	You guys my New Years resolution will be..... Not saying😂			Tue Dec 31 21:11:42 +0000 2013
418127348022923264	@TheRealJRSmith I honestly think your New Years resolution should be to win a couple games with ur crappy team, you guys suck.			Tue Dec 31 21:11:42 +0000 2013
418127349658292225	"My New Years resolution is to stop saying ""You go girl"" after every accomplishment."			Tue Dec 31 21:11:43 +0000 2013
418127350891835392	My resolution for New Years is NIGGA WE MADE IT	The Well	Eastern Time (US & Canada)	Tue Dec 31 21:11:43 +0000 2013
418127350917001216	stfu about having a New Years resolution— you're still going to be a stuck up bitch.	732 Jersey.	Atlantic Time (Canada)	Tue Dec 31 21:11:43 +0000 2013
418127352241979392	New Years Resolution: Play More Games..	Portland,Or	Pacific Time (US & Canada)	Tue Dec 31 21:11:43 +0000 2013
418127355547516928	my new years resolution is to meet the kardashians and marry brody jenner		Quito	Tue Dec 31 21:11:44 +0000 2013
418127359250685952	If I had to pick a new years resolution it woulda be to work smarter, not harder	U.S.A	Mountain Time (US & Canada)	Tue Dec 31 21:11:45 +0000 2013
418127362673635328	My New Years resolution is to embody everything Olivia Pope is and become her		Atlantic Time (Canada)	Tue Dec 31 21:11:46 +0000 2013
418127363361079296	My New Years resolution is to be happy, that's all I want	| 0/5 | gina+beau/5 | 0/4 |	Auckland	Tue Dec 31 21:11:46 +0000 2013
